index,review_text,review_rating,review_title
0,NOTE:,3.0 out of 5 stars,"Which iPhone you should Purchase ? iPhone 8, X, XS, XR ?"
1,Very bad experience with this iPhone xr phone. Back camera found defective and non functional. Amazon is very careless. I haven't got any response on confirmation for replacing. I am just hanging with a damaged piece worth of more than 91000 rupees.,1.0 out of 5 stars,Don't buy iPhone xr from Amazon.
2,Amazing phone with amazing camera coming from iPhone 7 plus great service from amazon,5.0 out of 5 stars,Happy with the purchase
3,"So I got the iPhone XR just today. The product looks amazing. But unfortunately the Face ID is not working and there’s a glitch in the front camera’s portrait mode. That’s fine, it may happen. But what’s not fine is the pathetic service provided by amazon and apple. Firstly, amazon takes no responsibility of the product once sold. Talking about the giant, apple, the so called market leaders. Went to the service centre, after running a diagnostic the solution they came up with is sending the phone to Bangalore for repair. Like sending the new phone for repair is the practical solution that the company provides after charging a bomb for the product. And also to mention, amazon.in is not an authorised apple reseller. I guess this issue will be escalated to the consumer court. Thank you amazon and apple!",1.0 out of 5 stars,Amazon is not an apple authorised reseller. Please take a note.
4,"I've been an android user all my life until I decided to try iPhone XR for iOS. Loving the camera and battery life is an absolute joy to have. It's been more than one month since I got this phone and I'm loving it. Face ID works flawlessly even in the dark and the dual sim function is working like a charm, I'm using Vodafone as my primary sim and Jio as e-sim and have faced no problem whatsoever.",5.0 out of 5 stars,Excellent Battery life and buttery smooth UI
5,I was delivered a phone that did not work immediately after removing from the box. I was not able to return it as I need to first check with Apple. Apple service told me that the phone was lying without charge since 5 months and hence the battery failed. Now I have had to leave the phone with Apple for repairs and waiting for them to replace the battery. Please answer this: WHY SHOULD I RUN AROUND FOR THE SUB PAR QUALITY DEVICE WHEN I WAS SHIPPED A DEAD PHONE? Last time I ever purchase a phone online,1.0 out of 5 stars,Never purchase a phone online.
6,"It has been a month since I started using my iPhone XR and the experience has been awesome. Excellent battery life, smooth operating system, and most of all, dual Sim functionality are the best features of this iPhone. Spent so many days to decide on the colour, but opted for white, and I’m very happy about it. Coral is also a very good colour option which I have bought for my wife. Only issue bothering me is the time taken to charge the phone. You need to opt for overnight charging. Other than that, extremely happy with the purchase.",5.0 out of 5 stars,Awesome iPhone
7,The phone is hanging. Video quality is not very good.,1.0 out of 5 stars,Exchange of I phone xr with xs.
8,I'll use this review to mostly say what I'm not a fan of in this particular iPhone model.,4.0 out of 5 stars,Worth upgrading from the 6S? I'll know in a few months
9,Went with the iPhone XR after over a month of consideration.Amazon was offering some really good discounts and felt the time was right to upgrade having used the iPhone 6 for four seamless years.,1.0 out of 5 stars,Def a bad experience
10,NOTE:,3.0 out of 5 stars,"Which iPhone you should Purchase ? iPhone 8, X, XS, XR ?"
11,Very bad experience with this iPhone xr phone. Back camera found defective and non functional. Amazon is very careless. I haven't got any response on confirmation for replacing. I am just hanging with a damaged piece worth of more than 91000 rupees.,1.0 out of 5 stars,Don't buy iPhone xr from Amazon.
12,Amazing phone with amazing camera coming from iPhone 7 plus great service from amazon,5.0 out of 5 stars,Happy with the purchase
13,"So I got the iPhone XR just today. The product looks amazing. But unfortunately the Face ID is not working and there’s a glitch in the front camera’s portrait mode. That’s fine, it may happen. But what’s not fine is the pathetic service provided by amazon and apple. Firstly, amazon takes no responsibility of the product once sold. Talking about the giant, apple, the so called market leaders. Went to the service centre, after running a diagnostic the solution they came up with is sending the phone to Bangalore for repair. Like sending the new phone for repair is the practical solution that the company provides after charging a bomb for the product. And also to mention, amazon.in is not an authorised apple reseller. I guess this issue will be escalated to the consumer court. Thank you amazon and apple!",1.0 out of 5 stars,Amazon is not an apple authorised reseller. Please take a note.
14,"I've been an android user all my life until I decided to try iPhone XR for iOS. Loving the camera and battery life is an absolute joy to have. It's been more than one month since I got this phone and I'm loving it. Face ID works flawlessly even in the dark and the dual sim function is working like a charm, I'm using Vodafone as my primary sim and Jio as e-sim and have faced no problem whatsoever.",5.0 out of 5 stars,Excellent Battery life and buttery smooth UI
15,I was delivered a phone that did not work immediately after removing from the box. I was not able to return it as I need to first check with Apple. Apple service told me that the phone was lying without charge since 5 months and hence the battery failed. Now I have had to leave the phone with Apple for repairs and waiting for them to replace the battery. Please answer this: WHY SHOULD I RUN AROUND FOR THE SUB PAR QUALITY DEVICE WHEN I WAS SHIPPED A DEAD PHONE? Last time I ever purchase a phone online,1.0 out of 5 stars,Never purchase a phone online.
16,"It has been a month since I started using my iPhone XR and the experience has been awesome. Excellent battery life, smooth operating system, and most of all, dual Sim functionality are the best features of this iPhone. Spent so many days to decide on the colour, but opted for white, and I’m very happy about it. Coral is also a very good colour option which I have bought for my wife. Only issue bothering me is the time taken to charge the phone. You need to opt for overnight charging. Other than that, extremely happy with the purchase.",5.0 out of 5 stars,Awesome iPhone
17,The phone is hanging. Video quality is not very good.,1.0 out of 5 stars,Exchange of I phone xr with xs.
18,I'll use this review to mostly say what I'm not a fan of in this particular iPhone model.,4.0 out of 5 stars,Worth upgrading from the 6S? I'll know in a few months
19,Went with the iPhone XR after over a month of consideration.Amazon was offering some really good discounts and felt the time was right to upgrade having used the iPhone 6 for four seamless years.,1.0 out of 5 stars,Def a bad experience
20,Best mobile  and my favourite Where nice XR Amazing futures and best camera so thanks for  Amazon,5.0 out of 5 stars,Best of best quality
21,"Don't buy Apple products from Amazon. I got a defective product which is not activating. During first charging the iPhone started heating like anything. Since there was a 10 days replacement policy, so I asked Amazon to replace it as the product is defective. But very poor customer service from Amazon. They didn't change the iPhone rather told me to visit service centre. Now I am with a defective product which is not operating.",1.0 out of 5 stars,Horrible Experience with Amazon
22,Face recognition is slower some times. I have no complaints about it. I am die hard fan of XR. I was eagerly waiting for dual sim iPhone. It’s heavy but looks are so attractive that you will be ready to carry that little extra weight. I am using it since two months. Don’t watch any reviews. Just buy it and enjoy. Yes it’s expensive. Sometimes rather many times money is not worth than happiness.,5.0 out of 5 stars,It fulfilled my expectations.
23,"Great Phone, I am happy with the phone so far.",5.0 out of 5 stars,"Great phone, if you don't care about OLED screen, colors"
24,"There are lots of reviews on net for XR, I would give just quick points based on my experience of XR 128 GB.",5.0 out of 5 stars,A Dark Horse
25,Don’t buy this phone only waste of money it hang’s many time.,2.0 out of 5 stars,Hang’s many time
26,STEVE JOBS GONE i phone gone !!!!!!,1.0 out of 5 stars,I PHONE  THOFE ME MILE THO LELO
27,Single SIM is working fine but if you are using E-sim in this phone. Not good quality for dual sim. Many times Number showing switched off.,3.0 out of 5 stars,Network Issue if you are using dual sim in iPhone XR
28,It is not supporting any type of sim.. the network gets disconnected after sometime only,1.0 out of 5 stars,Not supporting any sim
29,"i always was unhappy with the size of my previous iPhones (iPhone 7 and 5s), I badly needed an upgrade and but don’t have the budget of 1lakh so I took my chances with XR and I am very happy with my purchase.",5.0 out of 5 stars,Best Buy!! iPhone XR full fills the dream of big iPhone
30,This is a product which lets down the whole high end feel of an iPhone. Apple has packed in a very sophisticated software hardware system in a rather disappointing design and the phone is bulkier and heavier than any of its competition in the market. The premium feel of the product is completely let down and left to enjoy is a good software interface of ios and an excellent camera. Overall a cheap buy for an apple lover but for a first time user the phone is totally let down.,3.0 out of 5 stars,Disappointment for an iPhone
31,Im facing some speaker related issues and had given my handset XR 64 Gb in service center they denied to repair the same stating that the handset is fake and not valid for any warrenty,1.0 out of 5 stars,Fake handsetset received
32,All in all an amazing product yet again from Apple. I know many people are confused wheather to go for an apple X or Xr. Well to be frank i suggest XR purely because of the fact that XR will have 1yr more support from Apple in respect to X.  Other than that the dual camera of X and single camera of XR have the same quality. As far as speed goes both are same. Xr is dual sim but you gotta understand you can insert just 1 sim. The 2nd sim is an eSim which needs to be activated by Telecom service providers. Theres not much difference in display as well. All in all XR rules,5.0 out of 5 stars,Go for XR if you confused between X and XR
33,I had taken the phone but the phones holds too many defects and issues. When we talk the mouth pice is not that precise to hold you voice creaky the voice is not audible if the phone is even partially away from your chin/mouth.,1.0 out of 5 stars,Pathetic Apple and IPhone Review
34,there are two angles from which smartphones are generally looked. and i will be very honest in this review so that a genuine user can understand if he really wants apple!,5.0 out of 5 stars,"got at ₹49,900 but do i wasted my 50k?? ABSOLUTELY NO!"
35,"Smooth as butter, no lag and awesome display with superb camera..Just the perfect phone",5.0 out of 5 stars,Smooth as Butter
36,"Using around a week now. It’s snappy fast. Power efficient. Gives a back up of a whole day on average use. It has a single but impressive rear camera. Selfie camera is excellent. Low light performance is average though. The phone is bulky, Heavy, weighing more than 190 grams. You surely need to use a protective case to protect Camera bump and glass on both sides. Display is crisp.",5.0 out of 5 stars,Nice Phone
37,This is by far the best smartphone i have ever owned.,5.0 out of 5 stars,Awsome Product by Apple
38,"A Perfect Phone with a great camera, great performance, Great look, Great Battery life and a good Display. Worth the trade off. Perfect size",5.0 out of 5 stars,Awesome Phone
39,"NEVER BUY it from Amazon. VERY POOR PRODUCT AND CUSTOMER CARE.i bought it and received it on 3.10.2019 and noted a crack on right top corner of display which was visible when the plastic sticker was removed and complained to amazon customer cell on 4.10.2019. they assured a replacement. nothing happened. when i called them a number of times, they simply tranfer my calls to diiferent sections and then assurinng call back and then not calling back. Apple says it is the duty of amazon to take measures for replacement. Still left nowhere with my money gone on a damaged product.",1.0 out of 5 stars,NEVER BUY FROM AMAZON
40,Extremely easy to use. Good specifications.,5.0 out of 5 stars,Worthy buy
41,Best iPhone I’ve used. Sold my one plus 6 and got this one. The screen is not an OLED so you miss out on deep blacks and saturation. But I noticed the colours are better than the older iPhones with LCD. It also has thick bezels which take some time to get used to. An OLED screen on this would’ve been wonderful but apple being apple wont do that!,5.0 out of 5 stars,Amazing phone! iOS makes it worth the money! Delivered 3 days late by the seller.
42,Poor Front camera cannot take photo with light at background (photo attached),1.0 out of 5 stars,Worst camera
43,"This is my first phone from Apple. I was in confusion in buying between pixel and iphone. Even though pixel is far superior than apple in all departments, I went for iphone due to craziness. The product is well packed and delivered. When I started using the phone, the screen looks average, battery is good and the hardware seems good. The camera disappoints me al lot. Never expect this from Apple. In particular, the front camera is worst, in indoor lightning conditions and can see dots in image like a VGA camera.  At a cost of 60k, I was more so curious about the camera. It disappoints me badly. Even my motorola camera works well. If you are crazzy for the brand, go for it. Else definitely, you can go for other models in the market.",1.0 out of 5 stars,Disappointed !!!
44,This Appario seem to be a fraud. My shipment has been smartly tampered and the have managed to overcome the security features. Even iPhone package back label have been tampered. Amazon Customer Care on phone or Twitter is of no help. I need to return this and get a replacement.,1.0 out of 5 stars,Tampered shipment & product
45,"Most Beautiful, Fast and Stylish iPhone, I've ever Had..",5.0 out of 5 stars,"Most Beautiful, Fast and Stylish iPhone, I've ever Had.."
46,"Like every time, Apple has again mesmerised me with it’s great creation iPhone XR. The best part in this is when you unbox your brand new iPhone. It comes with an earpod, and a Fast charger. I understand that the price might be a bit high but trust me, it’s worth it. The camera has the best feature within it. Everyone says that it’s an LCD screen but you’ll nit be able to differentiate just by looking at the screen. The phone performance  is more faster now. And last but not the least, I am really impressed with the battery back up time. It really lasts. Full charge at 10 am and then the whole day on Cellular Data, I have played PES2019, played some songs from YouTube Music, hovering on Whatsapp, Instagram, Facebook and clicked some good photos. When i came back home at 11 o’clock, i still had 66% charge. That’s what we needed in an iPhone.",5.0 out of 5 stars,The Best Choice !
47,iPhone XR is excellent there is no doubt about this. This first time my iPhone experience. Its great experience. But I am very unhappy about the dual sim performance (May be solved the problem).,3.0 out of 5 stars,Problem with Dual SIM
48,Been a iPhone user always. Upgraded to iPhone XR from iPhone 6 and I have no regrets. Just love the ease that face recognition brings in... freedom that 128GB memory brings in... and of course peace of mind that Apple brand name brings in.,5.0 out of 5 stars,Best iPhone till date
49,the phone wont turn on,1.0 out of 5 stars,faulty product sent
50,"A lot of criticism of iPhone XR has been about its inability to take portrait pics of “only human faces!” Though true, it can be very easily overcome by downloading a software app - “Halide!” That and the near negligible difference in viewing experience, puts it on par with iPhone XS and even XS Max! Just go for it— the 256 GB storage version!",5.0 out of 5 stars,Go for iPhone XR 256GB!
51,Prices have fallen by rs 10000 in 3 days after I bought my phone. I feel terrible.,1.0 out of 5 stars,Prices have fallen by rs 10000 in 3 days after I bought my phone. I feel terrible.
52,Faulty product delivered and Amazon not giving replacement. Cheating with customer and just making money by scam and defective product delivery. Phone is not usable as display stop working randomly and screen freeze suddenly. I have provide problem video also to Amazon within 10 days of replacement but Amazon just making money and cheating with customer.,1.0 out of 5 stars,Pathetic service from Amazon
53, Iphone is good but probably I have received a defective piece from amazon as I am facing issues with software. Further never heard a iphone to be hanging issue but I am facing the same and attached a video regarding it. Within a month I have to visit customer care and still facing issues. Very worst experience don’t buy it from amazon.,1.0 out of 5 stars,Just don’t buy it from amazon totally waste of money.
54,"Super fast performance, long battery hours, little heavier than iphone 7 plus. Overall good phone.",5.0 out of 5 stars,"Fast, long battery hours"
55,Has many drawbacks. Apps developed for iPhone by Indian Companies aren’t good at all. You can’t even do a normal Tatkal booking as irctc app unavailable. No dual Whatsapp so one number is wasted. No dual Facebook as well. Maximum 5gb cloud backup storage limit. Apps get refreshed more frequently and better enhancements on android. No features to search apps easily. Wifi once disconnected loses auto join features. Maximum 100 call records that’s very very annoying. Difficult to set primary and secondary sims in sms. Some Whatsapp features missing.,2.0 out of 5 stars,Disappointing in many ways
56,It is heavy weight if u use more ull feel it hard to hold on regular note!,3.0 out of 5 stars,It is heavy weight phone
57,"There have been multiple issues faced since started installing and restoring from icloud. Gets hanged/stuck, suddenly WiFi gets disconnected and doesn't get connected till restart, deteriorated network speed on usage of the data.....",1.0 out of 5 stars,Bad quality/performance
58,"First off, the battery life is INCREDIBLE! This is the first phone I have used where I can get two days of use on one charge! I would regularly charge the phone overnight one night, then go to bed at midnight with 55-60% left the next night, leave it unplugged, and finish the next day at midnight with around 2-5%. The size of the phone was just just about perfect for holding/scrolling with one hand, and I usually wear men’s size medium gloves for reference.",5.0 out of 5 stars,Superb price thanx to amazon
59,"When compared with XS only visible difference would be screen, that too when kept side by side.",5.0 out of 5 stars,Worth Every Penny
60,"Awesome IPhone.. I have upgraded from iPhone 6 and I can notice the significant different in display, touch and XR is certainly faster. It’s worth the upgrade..! Thank you Amazon for delivering it securely.",5.0 out of 5 stars,I love it..!
61,"Got this phone for offer price. Everything is great from packing to delivery. Display quality is very good. Dual sim option is very good, got esim from airtel",5.0 out of 5 stars,Xcellent phone
62,Bought this phone for my wife. She's absolutely happy with the phone.,5.0 out of 5 stars,Best iPhone to buy at this price.
63,I want to replace this iphone because since i got this it worked well for w week then later on its speed is slowed down and even it hangs sometimes. Its been 3 months since i got this n i m already irritated with this device. My lighting usb has already stopped working .,1.0 out of 5 stars,Swap my iphone xr
64,Great phone for better photos and low light battery usage is much better than X,5.0 out of 5 stars,Thanks apple India. Very very thanks amazon for faster delivery and original product
65,"So overall it’s a pretty nice phone, I honestly don’t find much difference in features from my old iPhone 6. Apart from face recognition.",4.0 out of 5 stars,Good phone but horribly heavy
66,Good phone,5.0 out of 5 stars,Very good phone very fast
67,"I’ve been using Android for close to a decade and now decided to check out iOS. Thanks to Amazon Prime Sale, got iPhone XR for a discounted price(Still expensive), Coming to the iPhone itself, after using phone for 3 days, below are the points I came across.",4.0 out of 5 stars,My First Apple iPhone
68,Using this phone since 2 months. Here is my review. Hope you will find it useful.,5.0 out of 5 stars,Nice Phone
69,"I was skeptical looking at some XR reviews and also purchasing an iPhone off Amazon (previously always bought through Apple Stores). However, so far happy with what I have. The delivery was fast (on Prime, next day); all original packing (phone box) and phone is working fine. Touchwood - no issues. The Deal was good with the 10% additional HDFC discount. Go for 128 GB (or even higher) - the few extra thousand are worth it when you run out of space.",5.0 out of 5 stars,XR Deals seem very good
70,I got a defective iPhone XR. The screen is defective. There’s a blue shade on all the four sides of the screen. The phone’s working completely fine though.  So whoever purchased the phone while unboxing please check your device thoroughly. It was my mistake that i thought that maybe it’s something related to software which will be fixed after software update but it didn’t. And in that belief i skipped my 10 days return policy as well. I still don’t blaim amazon because i have purchased my Airpods from them as well. But still appario should not sell defective products to customers. Now i have to go through a hassle of getting the screen replaced from service centre and for that service centre will keep my phone for at least 7-10 days. It’s disappointing that i have to go through all this for a brand new phone. The reason why i didn’t upload a pic is bcuz it will not be visible in a pic taken from another phone.,2.0 out of 5 stars,Got a defective screen product delivered.
71,ALL good,5.0 out of 5 stars,Loved it
72," I chose iPhone XR over x. The reasons are, it is 6.1-inch display and supports dual sim. the Battery Durability longs last. I got the Brand New peace (made in 2019, September) without any defect.",5.0 out of 5 stars,Blindly go for it.
73,"During the great India sale, I saw this model on offer and my sister was dying to get a new phone since her old phone was barely keeping up. I finally made up my mind,, arranged the funds and got it for my sister.",5.0 out of 5 stars,Apple's most selling model
74,"Phone looks beautiful. I bought it just one month before thru Amazon, when I put my sim it's speaker has not been working , it is difficult to listen voice sometimes it becomes disconnected. Although my android phone is working good at the same place. I don't know whom should I contact about my complaint.",1.0 out of 5 stars,iPhone beautiful but not functional
75,"After transition from Android to iOS, I felt Android is more user friendly compared to iOS.",5.0 out of 5 stars,Felt Android is better compared to ios
76,I am not able to activate iphone after several attempts. Today only i purchased.,1.0 out of 5 stars,Not getting activated
77,Hello friends!! This is my honest review after using it for almost 2 months. I was using android since last seven years but then I decided to go for iPhone. Here are the pros and cons according to me which I have felt after using it for almost 2 months,4.0 out of 5 stars,"PHONE IS GOOD, but THE OPERATING SYSTEM (ios) IS NOT!!"
78,So upgrading from 6S+ to XR. First reactions:,4.0 out of 5 stars,"Good phone, good deal"
79,Everything look good but I never expect.,1.0 out of 5 stars,🙏🏽
80,"Upgraded from 5s to xr after 3 years of 5s use. Purchased it at ₹37999 after low battery issues with 5s. Why I choose xr rather than iPhone 8 ,7 or even 6s even when I bought 5s after 3 years of its initial launch is",5.0 out of 5 stars,Apple's Perfection at a premium but ....
81,"Before I start this review I’ll let you know, I love the Apple brand and I’ve never used a 1080p OLED phone in my life (This screen seems perfectly normal to me). That being said I’ll dive into the review. I got this phone on the Prime day sale and I’ve been using it for almost a month now and here are my thoughts about this phone.",5.0 out of 5 stars,Great hardware + Stunning software = 1 magical experience
82,Got this product in the amazon flash sale and got a decent discount. Have been using the device for a few days and can certainly say that this iPhone has the best battery life till date. Phone lasted for almost 30 hours with heavy usage. The face recognition has certainly been improved from iPhone X. The only thing I dislike about the phone is the Screen Quality. You won’t find any major difference in the screen quality unless and until you stream Netflix or watch YouTube. Overall I feel this is one of the best iPhones apple has launched.,4.0 out of 5 stars,iPhone with the Best Battery Life
83,You will always feel cheated after buying an iPhone. It will get cheaper by every next 2-3 months.,4.0 out of 5 stars,ok
