index,review_text,review_rating,review_title
2744,My First iPhone. Great battery life. Good camera. Great performance.,5.0 out of 5 stars,Great performance...
2745,Thanks Amazon for this product I love xr wow amazing phone..  🥰🤟😍,5.0 out of 5 stars,Amazing phone
2746,Face recognition not strong,4.0 out of 5 stars,Face recognition not strong
2747,Good mobile overall good performance,5.0 out of 5 stars,Good performance overall
2748,Thanks for amazing price for I phone,5.0 out of 5 stars,Greatest ever
2749,Theta was big problem with ringtones,1.0 out of 5 stars,Average product. Not value for money
2750,apple is apple another thing XR battery life too good,5.0 out of 5 stars,overall ok as compare price. battery backup mind blowing
2751,Excellent Quality....,4.0 out of 5 stars,Suhas
2752,Very gud phone,5.0 out of 5 stars,Gud
2753,Very very good,5.0 out of 5 stars,Good
2754,Likes: Camera and Display,5.0 out of 5 stars,Simple Review
2755,Nice phone !!!  valuable !!!,5.0 out of 5 stars,Lovely Look
2756,perfect phone to spend money,5.0 out of 5 stars,classy phone
2757,Best phone with super battery life and super camera,5.0 out of 5 stars,Amazing phone with good battery life
2758,Camera quality and battery performance is very good,5.0 out of 5 stars,Premium product
2759,Excellent phone excellent camera and good gaming experience,5.0 out of 5 stars,Amazing zing zing
2760,Superb phone nothing worried about display simply go for it,5.0 out of 5 stars,Excellent mobile
2761,Nice product,4.0 out of 5 stars,Nice
2762,Highly recommended top performance in low price,5.0 out of 5 stars,best iphone ever
2763,Calling to unsaved number is not allowed by secondary number,1.0 out of 5 stars,Not user friendly
2764,It’s really a good product. Battery is good,5.0 out of 5 stars,Best phone ever
2765,I hate the notch and that’s it,5.0 out of 5 stars,Top NOTCH device
2766,Finger print reader is working good and camera quality is also good,5.0 out of 5 stars,Value for money and you can purchase it in amazon without any worry
2767,Totally amazing good battery life and good camera with good speaker,5.0 out of 5 stars,Worth every penny
2768,Gud phone better than 8 gud upgrade from it.battery life is awesome,5.0 out of 5 stars,Gud phone
2769,Mind blowing features and Operating system Excellent Battery backup,5.0 out of 5 stars,True Value product
2770,Entirely different for an android user.... But battery life is good,4.0 out of 5 stars,Good
2771,Battery life :not good,5.0 out of 5 stars,Choose fingerprint for Mobile
2772,Great product with quality ecosystem. Apple is very stable product.,5.0 out of 5 stars,Great product
2773,Genuine product,5.0 out of 5 stars,Good choice
2774,Amazing product... came in good condition... fast delivery,5.0 out of 5 stars,Best triggers....
2775,Good,5.0 out of 5 stars,Cool
2776,Screen to body ratio,5.0 out of 5 stars,Epic phone
2777,Awesome phone,5.0 out of 5 stars,Really good product from Apple
2778,Loved it,5.0 out of 5 stars,Nice in good price
2779,Nothing to say. Perfect one,5.0 out of 5 stars,Awesome
2780,Fabulous products excellent,5.0 out of 5 stars,Very nice products
2781,"NIce yellow color, well received with all the accessories.",5.0 out of 5 stars,Bright yellow color looks Awesome
2782,Build quality is avarage# camera is good # battery is good,4.0 out of 5 stars,Build quality is avarage
2783,Nice device best for gaming and amazon price was wery good,5.0 out of 5 stars,Best price
2784,Superb,5.0 out of 5 stars,Superb
2785,Thanks,4.0 out of 5 stars,Hi
2786,Superb,5.0 out of 5 stars,Super phone
2787,Awsome,5.0 out of 5 stars,Worth to money
2788,It's a great phone  but it's kind of heavy then other apple mobiles,4.0 out of 5 stars,Loved it
2789,Battery Life Beat economy Phone from Apple,5.0 out of 5 stars,Good Buy
2790,Best value for money iphone to buy in 2020,5.0 out of 5 stars,Best iphone under 50k
2791,Everything is Awesone Using From 2Months No Problem 😍😍 Fantastic,5.0 out of 5 stars,Fantastic 😍
2792,I am and apple fanboy and I do love this phone.....,5.0 out of 5 stars,Im in love
2793,There is no fingerprint reader but face unlock is excellent,5.0 out of 5 stars,Over all best phone
2794,Good performance but display n battery thumbs down,3.0 out of 5 stars,XR
2795,Best to buy iphone xr 128gb,5.0 out of 5 stars,Iphone
2796,Awesome phone! liked it very much!,4.0 out of 5 stars,Awesome phone! liked it very much!
2797,My first apple buy. Glad I did it.,5.0 out of 5 stars,XR is goood.
2798,I liked the features,5.0 out of 5 stars,very good
2799,Love it,5.0 out of 5 stars,Love it
2800,I got my iPhone in a very good condition and was very happy,5.0 out of 5 stars,A good phone from a good marketing website
2801,Super mobile,5.0 out of 5 stars,iPhone XR is the budget iPhone.
2802,Good product,5.0 out of 5 stars,In a affordable range apple best product
2803,Happy to use,5.0 out of 5 stars,Nice product
2804,awesome product ......Total paisa basool,5.0 out of 5 stars,Fully Worthing
2805,👌,5.0 out of 5 stars,👌
2806,Awesome phone,5.0 out of 5 stars,Awesome phone
2807,Have been since three weeks. Feeling really good.,5.0 out of 5 stars,Brilliant experience using iPhone XR
2808,Excellent mobile Go for it,4.0 out of 5 stars,Super
2809,Happy to buy after 6s plus,5.0 out of 5 stars,Get benefit great Indian sale
2810,One of the good product from Apple,4.0 out of 5 stars,Good battery life
2811,Love the battery life.,5.0 out of 5 stars,Great Phone.
2812,Excellent product. That’s why Apples are costly. Worth it,5.0 out of 5 stars,Top line Quality
2813,Super,5.0 out of 5 stars,Suuperr
2814,Build quality is good.but side is too big to handle single handed,4.0 out of 5 stars,Nice product
2815,"Great quality, superb performance",5.0 out of 5 stars,iPhone is really a rockstar
2816,Iphone is not detecting headphones within 2 weeks after buying...,1.0 out of 5 stars,Iphone not detecting headphones
2817,"Very nice product ,its camera quality is awesome than other phone",5.0 out of 5 stars,Best phone ever
2818,Excellent product. Very satisfied,5.0 out of 5 stars,Great Buy
2819,Nice product. Great apple product,5.0 out of 5 stars,Best Apple Product
2820,"Smooth, battery drains faster tho",5.0 out of 5 stars,Myphone
2821,Awesome phone with great features,5.0 out of 5 stars,Awesome
2822,"Delivery issue but everything 👌👌phone,camera,battery",5.0 out of 5 stars,Ok
2823,Voice not clear in calls,2.0 out of 5 stars,Issue in hearing
2824,Camera quality....,5.0 out of 5 stars,Good quality camera
2825,All is good,5.0 out of 5 stars,Good phone
2826,Great phone,5.0 out of 5 stars,Great phone
2827,Best mobile,5.0 out of 5 stars,Superb
2828,Nice phone. Go for it when it is in offer period,5.0 out of 5 stars,Nice phone
2829,iPhone XR good but amazon cashback only cheating,4.0 out of 5 stars,Good product but amazon cashback cheating
2830,It has good battery life with dual sim support with esim,5.0 out of 5 stars,Good battery
2831,Best phone ever been used,5.0 out of 5 stars,Fully satisfied
2832,Kool,5.0 out of 5 stars,Kool
2833,Good,5.0 out of 5 stars,Good phone
2834,Good,5.0 out of 5 stars,Good
2835,Nice,5.0 out of 5 stars,Most expensive
2836,Good,5.0 out of 5 stars,Worth the money but heavy and low performance of battery
2837,"Great build quality as expected from apple , its light and rigid",5.0 out of 5 stars,Great phone must buy
2838,My battery get exotic and also the touch is not working properly,4.0 out of 5 stars,Exchange phone
2839,"Everything is working prefect, just need a bill copy from seller",5.0 out of 5 stars,Superb
2840,Nice phone every think is good in mobile,5.0 out of 5 stars,Good
2841,The experience would be awesome. Try it.,5.0 out of 5 stars,Awesome!!
2842,Excellent,5.0 out of 5 stars,Very Good
2843,Superb battery life,5.0 out of 5 stars,Amazing
2844,Nice battery backup,4.0 out of 5 stars,Good battery backup
2845,It's osm,5.0 out of 5 stars,I love it
2846,Overall good Phone at lower rate,5.0 out of 5 stars,Must buy
2847,Faster and full day battery life,4.0 out of 5 stars,iPhone for everyone
2848,Nice phone at amazing price in great Indian festival sale,5.0 out of 5 stars,Value for money and brand value...go for it
2849,Best phone ever...,5.0 out of 5 stars,Bestt
2850,This phone is value for money,4.0 out of 5 stars,Good phone
2851,Good product and excellent battery life.,4.0 out of 5 stars,Worth buy
2852,Liked the product as I am using from,5.0 out of 5 stars,IPHONE XR
2853,"Battery is very good compared to iPhone 6,7,8, plus ...",4.0 out of 5 stars,Satisfied ****
2854,"Amazing phone, very fast and battery life is also good.",5.0 out of 5 stars,Amazing phone go for it ...
2855,nice product but seal was open and all stuff were there,5.0 out of 5 stars,box was open but all intact
2856,Good in all expectations,5.0 out of 5 stars,Very much satisfied
2857,all features are 100 % good qaulity.such a like i phone xr(128),5.0 out of 5 stars,good
2858,everything is working fine. one can easily purchase it blindly.,5.0 out of 5 stars,Nice phone
2859,Very good product must buy 🔝,5.0 out of 5 stars,Must Buy Value For Money
2860,I get a defectives phone I will never buy an online phone again,1.0 out of 5 stars,Defective phone
2861,Awesome phone just delivery is too late,5.0 out of 5 stars,Loved it
2862,Good battery life. Fast face unlocking.,5.0 out of 5 stars,Perfect phone.
2863,I am satisfied with the product,5.0 out of 5 stars,I Phone XR
2864,"Please buy from iPhone store, if you love using I phone.",1.0 out of 5 stars,iPhone purchase
2865,Good Product Worth to Buy,4.0 out of 5 stars,Good Product Worth to Buy
2866,Good product with a high quality,5.0 out of 5 stars,Awesome product by apple
2867,Very Nice and Decent Phone. Looks premium and also very Smooth,5.0 out of 5 stars,Very Right Choice
2868,Heating issue. You have to play pubg under A.c.,5.0 out of 5 stars,After 1 month use. Honest opinion.
2869,Excellent phone.Battery quality is the best.,5.0 out of 5 stars,Excellent battery
2870,Absolutely good products n delivery all good quality,5.0 out of 5 stars,Fantastic n good products
2871,Wow phone,5.0 out of 5 stars,Wow
2872,Very good,5.0 out of 5 stars,Best
2873,Very good,4.0 out of 5 stars,Good
2874,Very good,5.0 out of 5 stars,Superb
2875,Best,5.0 out of 5 stars,Best phone
2876,got a defective product,1.0 out of 5 stars,Worst Experience
2877,Excellent,5.0 out of 5 stars,Excellent
2878,Simply superb 👌🏼👌🏼 One of the best I phone ever 😍,5.0 out of 5 stars,Best I phone XR
2879,Front camera quality not to good..so so type..,5.0 out of 5 stars,Affordable prices and very good phone
2880,Iphone XR is already Ultimate Product by Apple,5.0 out of 5 stars,Awesome Apple Iphone XR
2881,The display is kinda ok,5.0 out of 5 stars,Display
2882,Speechless to say about king of jungle.,5.0 out of 5 stars,Shettan ka sallaa
2883,Ok,5.0 out of 5 stars,Ok
2884,👌,5.0 out of 5 stars,Good one
2885,Charger is broken.. There is no warranty details for the same.,2.0 out of 5 stars,Charger issue
2886,Display quality is really nice and doesn’t seems to be HD only,5.0 out of 5 stars,Best in Budget
2887,Excellent product with great battery life and powerful camera.,5.0 out of 5 stars,Great phone
2888,I loved it really gr8 product ever from Apple after iphone 6S.,4.0 out of 5 stars,Expected the unexpected product from Apple
2889,Good smart i phone,5.0 out of 5 stars,Best phone ever
2890,awasome product .,5.0 out of 5 stars,awasome product .
2891,Black colour looks elegant and phone is super fast with great battery life,5.0 out of 5 stars,Feedback
2892,Excellent phone,5.0 out of 5 stars,Awesome 😊
2893,"I got perfect iPhone mobile,  its working fine.",5.0 out of 5 stars,Suppliers is awesome
2894,I like all the features of this phone and the system is very user friendly.,5.0 out of 5 stars,This phone is awesome
2895,Good Phone,4.0 out of 5 stars,Good One
2896,Best deal got @ ₹37999/- only.,5.0 out of 5 stars,Awesome
2897,Best budget phone,5.0 out of 5 stars,Amazing
2898,I purchased at a very high price .Best at the 40k ramge,4.0 out of 5 stars,40k best
2899,Satisfied with the phone,5.0 out of 5 stars,Nice one
2900,Awesome product met all my expectation,5.0 out of 5 stars,Awesome product
2901,WORKS SMOOTH WITH NICE CAMERA & BATTERY,4.0 out of 5 stars,ITS GOOD
2902,Really out Standing and camera quality amazing,5.0 out of 5 stars,Out Standing Product
2903,Excellent phone,5.0 out of 5 stars,Brand for branded people
2904,All good,5.0 out of 5 stars,Good one
2905,amazing.,5.0 out of 5 stars,i love it.
2906,I love the camera clarity. Amazing battery life. Better than one plus 7,4.0 out of 5 stars,iPhone XR
2907,Amazing phone. Why did'nt 🍎 come up with it earlier!,5.0 out of 5 stars,Great product
2908,The supplier gave an iPhone whose box was not sealed!,1.0 out of 5 stars,Unsealed iphone box
2909,The phone is just a killer but the charger is so slow,5.0 out of 5 stars,Brilliant phone it is
2910,Camera coulr be somewhat better. Rest is good,4.0 out of 5 stars,Review
2911,Excellent battery life,5.0 out of 5 stars,"Excellent,dual sim working"
2912,Nice,5.0 out of 5 stars,Good
2913,Osm phone & also thank Amazon for perfect delivery timely....,5.0 out of 5 stars,Perfect delivery......
2914,The charging cable is not working from the time of purchased.,5.0 out of 5 stars,Charger is not working
2915,Be in simple word it’s awesome Iphone,5.0 out of 5 stars,Great experience
2916,Very good experience and worth buying,5.0 out of 5 stars,Worth the price
2917,Perfect iPhone,5.0 out of 5 stars,Most Loved iPhone
2918,Really good one for lower price im loving it ✌️,5.0 out of 5 stars,This one iz mine 😅
2919,Quite good phone for business,5.0 out of 5 stars,Go for it
2920,Best iPhone for the price and buttery smooth experience,5.0 out of 5 stars,Best value for money
2921,"Amazing product,100%Original and timely delivery by Amazon. Loved it.",4.0 out of 5 stars,Amazing
2922,Very happy with the received product. No issues whatsoever till date.,5.0 out of 5 stars,Great product
2923,👍,4.0 out of 5 stars,👍
2924,User interface,5.0 out of 5 stars,Much ahead of competition
2925,Awesome phone.,5.0 out of 5 stars,Nice phone
2926,EXILENT,5.0 out of 5 stars,EXILENT
2927,Awesome,5.0 out of 5 stars,AwesoMe
2928,Excellent A+++,5.0 out of 5 stars,Excellent
2929,A great phone. Good battery life which was required.,5.0 out of 5 stars,Xr is best
2930,There is not finger print reader it’s not applicable,5.0 out of 5 stars,Very good
2931,I have upgraded from iphone 6 to XR. Fully satisfied,5.0 out of 5 stars,Nice one
2932,Iphone name is enough,5.0 out of 5 stars,Far better than android
2933,Nice face reader with great battery life and camera quality,5.0 out of 5 stars,Nice product
2934,Genuine apple product and also a great phone in this Budget.,5.0 out of 5 stars,Iphone XR
2935,Battery is v gud nd camera is excellent,5.0 out of 5 stars,.
2936,Very very good,5.0 out of 5 stars,Very very very very good
2937,Excellent phone. Everything is great,5.0 out of 5 stars,Great Phone
2938,Excellent iPhone at affordable price,5.0 out of 5 stars,Excellent iPhone at affordable price
2939,Excellent phone at a wonderful price,4.0 out of 5 stars,Can’t go wrong with this iPhone at this price
2940,I love this build quality and camera,5.0 out of 5 stars,Not bad
2941,Good phone..oled screen should have been used instead of LCD,4.0 out of 5 stars,Good phone.. but a bit overpriced
2942,One word..! Simply Thope...!,5.0 out of 5 stars,Brilliant product
2943,Good pick for iPhone lovers.,4.0 out of 5 stars,Excellent phone
2944,Not worth it.,3.0 out of 5 stars,Expensive
2945,Only for use not for show off,4.0 out of 5 stars,good phone
2946,nice..,5.0 out of 5 stars,superb
2947,Amazing iPhone XR!,5.0 out of 5 stars,Amazing product
2948,Best iphone ever and wonderful battery life,5.0 out of 5 stars,The best iphone
2949,All features are very nice and good quality,5.0 out of 5 stars,iPhone XR Very nice Product
2950,One of the best smartphone in the market...,5.0 out of 5 stars,Awesome
2951,100% genuine product.. Thank You Amazon👍🏻,5.0 out of 5 stars,Happy
2952,Outstanding phone...,5.0 out of 5 stars,Awesome phone..
2953,Overall good product,4.0 out of 5 stars,Very good
2954,Great battery backup,4.0 out of 5 stars,Superb
2955,Best in every aspect,5.0 out of 5 stars,Love For IPhone
2956,Excellent phone,5.0 out of 5 stars,Excellent phone!
2957,Good product and genuine quality. Using it since 4 months..,5.0 out of 5 stars,Iphone XR
2958,Battery life is so good and looks so good in white color 😍,5.0 out of 5 stars,Awesome Purchase ♥️♥️
2959,With in three months charger not work where I will complain,4.0 out of 5 stars,Best Economical iPhone
2960,Great product.. Happy with the delivery provided by amazon.,5.0 out of 5 stars,Simply awesome
2961,Excellent phone. Little expensive but good in all respects.,5.0 out of 5 stars,Best phone ever by apple
2962,Bought for husband he liked it a lot,5.0 out of 5 stars,Awesome
2963,"Great phone, camera and performance",5.0 out of 5 stars,Best iphone
2964,Nice product for a very good price.,5.0 out of 5 stars,Awesome!
2965,Battery life and camera is too good,5.0 out of 5 stars,Apple iPhone XR (64GB)
2966,Front camera could have been better,5.0 out of 5 stars,Best from apple
2967,Excellent product and awesome proce,5.0 out of 5 stars,Goood and great
2968,"Good phone in terms of battery life, camera , and lcd display quality is very good.",4.0 out of 5 stars,iPhone xr
2969,Awesome,5.0 out of 5 stars,Awesome
2970,Fast is unlock,5.0 out of 5 stars,Nice phone great look Esim is not good its should be physical Sim both
2971,Loving this fone. FaceID is terrific.,5.0 out of 5 stars,total game changer
2972,Good product,5.0 out of 5 stars,Good product
2973,Good product,4.0 out of 5 stars,Great
2974,Good product,5.0 out of 5 stars,Good product
2975,Good quality,5.0 out of 5 stars,Value for mot
2976,Great,5.0 out of 5 stars,Value of money
2977,Amazing  product from Apple with so nice features.,5.0 out of 5 stars,Amazing  phone
2978,Excellent product t,5.0 out of 5 stars,Excellent phone great value
2979,Awesome camera quality,5.0 out of 5 stars,Best Buy for me
2980,Everything that you need to have in the iPhone is awesome.,5.0 out of 5 stars,Fantastic
2981,👍👍👍👍👍👍👍👍👍👍👍👍👍👍👍👍👍👍👍👍👍👍👍👍👍👍👍👍👍,5.0 out of 5 stars,Just wow 🤩
2982,Amazing purchase thank you Amazon.,5.0 out of 5 stars,Satisfied
2983,Wonderful gadget at a great price.,5.0 out of 5 stars,Wonderful gadget at a great price.
2984,Awesome product,5.0 out of 5 stars,Awesome product
2985,"Charger is not wireless, in features its given wireless charger.",3.0 out of 5 stars,charger
2986,Good price purchased,5.0 out of 5 stars,Diwali offer good price
2987,No finger print reader. Excellent camera quality and screen quality,5.0 out of 5 stars,Good phone
2988,Wonderful phone and camera,5.0 out of 5 stars,Excellent phone
2989,Great Value,5.0 out of 5 stars,Great Value
2990,Good,5.0 out of 5 stars,Good
2991,Good,5.0 out of 5 stars,Good
2992,Good,5.0 out of 5 stars,Good buy
2993,good,5.0 out of 5 stars,good
2994,Cool,5.0 out of 5 stars,Very good product
2995,Wow.,5.0 out of 5 stars,Excellent product from apple
2996,Good,5.0 out of 5 stars,Good
2997,Finest,5.0 out of 5 stars,👌
2998,Wonderful product and service and price by amazon,4.0 out of 5 stars,Thumbs up
2999,Face ID works best,5.0 out of 5 stars,Awesome phone
3000,Super and same set but camera quality is no best.,5.0 out of 5 stars,Super
3001,Amazing Phone with Amazing Camera.,5.0 out of 5 stars,Love it
3002,Iphone,5.0 out of 5 stars,Iphone naam hi kafi hai
3003,Everything is perfect worth budget iphone,5.0 out of 5 stars,Worth it
3004,bought this phone because of good prices.,5.0 out of 5 stars,iphone can be buy if it is available in good prices.
3005,This set is cost effective. Valuable more than it’s cost.,5.0 out of 5 stars,Delivered in time. This phone is awesome
3006,Low price then other market 😍Blindly love it Iphone XR😻,5.0 out of 5 stars,Iphone Xr ❤️
3007,I love Apple. Front cam awesome Really great for Face ID.,5.0 out of 5 stars,I ❤️🍎
3008,Fastest face unlock even in dark. Battery life is awesome,5.0 out of 5 stars,"Great style, value for money"
3009,The product is fab,5.0 out of 5 stars,Value for money
3010,Got at a gud price,5.0 out of 5 stars,Flawless phone
3011,Good quality phone,5.0 out of 5 stars,Good
3012,Excellent product!,5.0 out of 5 stars,Excellent
3013,This is nice phone,5.0 out of 5 stars,Nice phone
3014,Its a good product,4.0 out of 5 stars,Amazing
3015,like this product.,5.0 out of 5 stars,awesome
3016,Very good quality & user friendly,5.0 out of 5 stars,Very good quality
3017,Bought for 38000.... Nice,5.0 out of 5 stars,Buy only at offer period
3018, Superbbbbbbb,5.0 out of 5 stars,Nice product
3019,Awesome,5.0 out of 5 stars,Keep it up
3020,Best phone,5.0 out of 5 stars,Awesome Phone Highly Recommended
3021,It’s buatifull product...,5.0 out of 5 stars,Good product
3022,This sounds not available,1.0 out of 5 stars,Audio vedio nd music sound not response I have disturbed if u have I phone knowledger please help me
3023,Do one have to rate it 😊,5.0 out of 5 stars,Premium
3024,Great Phone ! as expected ! Thanks Amazon :),5.0 out of 5 stars,Great Phone ! Value for money
3025,Nice phone,5.0 out of 5 stars,Nice original product... Happy
3026,Nice phone,4.0 out of 5 stars,Nice phone
3027,Nice phone,5.0 out of 5 stars,Great at this price
3028,Nice phone,4.0 out of 5 stars,Gud products njoyed
3029,Amazing product from apple,5.0 out of 5 stars,Super Product from Apple
3030,transfer 5s to 10r direct.I love my xr very much,4.0 out of 5 stars,Xr Is bttrr deal at price tag of 43k
3031,Battery last longer and got good picture quality,5.0 out of 5 stars,Value for the money
3032,Awesome phone get it at very low price on amazon,5.0 out of 5 stars,Thanks amazon
3033,Good quality photos.. sufficient space available,4.0 out of 5 stars,Good value for money
3034,Best iPhone . Go for it !!.Display is also good.,4.0 out of 5 stars,.
3035,Good for the value,5.0 out of 5 stars,Apple i Phone review
3036,"Value for money, using Apple products since 2012",5.0 out of 5 stars,Apple Product
3037,A classic phone at a through away price.,5.0 out of 5 stars,Superb phone
3038,Terrific Buy !,5.0 out of 5 stars,Worth the Price
3039,Battery life is excellent & display quality is also good,5.0 out of 5 stars,Worth it
3040,Overall satisfied,5.0 out of 5 stars,I like it
3041,Very good product,5.0 out of 5 stars,Awesome Product
3042,Amazingly awesome,5.0 out of 5 stars,iPhone XR
3043,Got the phone the way it was expected...,5.0 out of 5 stars,Awesome
3044,Good fone,5.0 out of 5 stars,Good phone
3045,Too good better than Samsung S20,5.0 out of 5 stars,Good phone love build quality
3046,Sound is not clear. Bad speaker.,1.0 out of 5 stars,Speaker problem
3047,Nice to use,5.0 out of 5 stars,Good product
3048,Loving it,5.0 out of 5 stars,Best deal on amazon...
3049,Good product from iPhone,5.0 out of 5 stars,Happy with this product
3050,Perfect upgrade from 6s.,5.0 out of 5 stars,Great upgrade from 6s
3051,Good  phone,4.0 out of 5 stars,Good
3052,very good phone  with good batter back up,5.0 out of 5 stars,very good phone  with good batter back up
3053,Very nice product ..apple always rocks ..,5.0 out of 5 stars,Worth in this budget
3054,The battery was charging up to 84% only it was not getting up to 100%charge,1.0 out of 5 stars,Not charging till 100%
3055,Battery back is very good,5.0 out of 5 stars,Nice
3056,Very good,5.0 out of 5 stars,Awesome
3057,Beautiful,5.0 out of 5 stars,Beautiful device
3058,Nice good,5.0 out of 5 stars,Good product
3059,The mobile which we received is damaged one,1.0 out of 5 stars,Damage product
3060,sd,5.0 out of 5 stars,Battery backup is very good.
3061,My first Iphone... 👍👍.. Loved it.. Great deal,5.0 out of 5 stars,Great deal amazing photo
3062,Brilliant phone . Liked everything about it ...,5.0 out of 5 stars,Best phone I have ever had
3063,Superb. Thank you amazon for next day delivery.,5.0 out of 5 stars,Nice phone
3064,Battery life pathetic....,2.0 out of 5 stars,Battery pathetic
3065,Worst phone i have ever used. Very bad hardware quality,1.0 out of 5 stars,Its never worth the price
3066,At times I lose the screen light and can’t see anything,5.0 out of 5 stars,Feedback about XR
3067,Amazing product by Apple and cheapest price from amazon,5.0 out of 5 stars,Cheapest Price 😊
3068,screen thodi dull lagti he baki performance me dhasu he,4.0 out of 5 stars,👍
3069,I did not 1 year warrenty card...provide this,2.0 out of 5 stars,Didnt get warrenty card
3070,Best deal ever !,5.0 out of 5 stars,Best deal ever !!
3071,I just like them,5.0 out of 5 stars,Good
3072,Awesome phone.... Bought it in 47900 for 128 GB capacity,5.0 out of 5 stars,Satisfied with product
3073,Nothing to say I phone is I phone and it’s original,5.0 out of 5 stars,Good
3074,Good and high quality camera,5.0 out of 5 stars,Good
3075,Headphones not working,4.0 out of 5 stars,Good
3076,Face ID don’t work in some cases,4.0 out of 5 stars,Good
3077,It's awesome .very friendly. Love it .,5.0 out of 5 stars,I phone lover. Awesome phone
3078,Product got delivered as expected. Excellent!!,5.0 out of 5 stars,Trustable
3079,My life best phone...thank you amazone,5.0 out of 5 stars,Amazon’s best shopping address
3080,It is nice but it gets hang sometimes.,3.0 out of 5 stars,Average
3081,Beast if battery life is your priority,5.0 out of 5 stars,Best phone I have bought till date maybe!!
