index,review_text,review_rating,review_title
418,Original product at the best price.... got it during great Indian festival sale at an amazing discount.. so far after a few days of use must say it’s an obvious and noticeable upgrade for people using iPhone 7 and beyond .. camera quality is quite good if not the best ...battery life is just awesome ...,5.0 out of 5 stars,iPhone XR
419,I ordered it for my wife as she wanted to use IPhone for so long but was not willing to change her phone.,5.0 out of 5 stars,Magnificent
420,could not find fingerprint reader. Otherwise camera and battery life are good. I like live camera in edit mode in camera.,5.0 out of 5 stars,New iphone xr
421,I have purchased this product during the diwali sale on Oct 22 and now the adaptor doesn't work. A product worth 43k having an adaptor life of 22 days... I don't even know what else to do now. Removed the sim and started using old broken phone since morning,3.0 out of 5 stars,Adaptor not working within a month
422,I am using iPhone from last 8 years. This model no need to carry power bank(for me) compared with iPhone 6s and 7,5.0 out of 5 stars,Not carrying power bank
423,"People who say iPhone XR has inferior display, please use before u judge based on specs. I’ve been using Pixel and recently switched to iPhone XR and I loved it. Battery life is unrivalled and Fave ID is charm.",5.0 out of 5 stars,Back to iOS after 2 years and it’s Amazing!!
424,"5 star quality... 1st apple product for my wife and in the family, Very good phone, clear crisp sound quality, Amazing display ... Apple doesn't compromise with it's product. Highly recommended.",5.0 out of 5 stars,Highly recommended
425,This rating is not for the product.... Its for the seller... Who has delivered the product with scratches on the back panel.....,2.0 out of 5 stars,Scratches On The Back Panel
426,Nice products battery life is very good. Camera is ok. Amazon delivery is wrost as i have to ordered it twice. In between i suffer loss of 2500 rs as price has been increased after best discount period has gone.,4.0 out of 5 stars,Nice Smartphone but experience wrost Amazon dilivery service
427,I am so happy with amazon.!! Good price and get it on time and yes perfect original product..!! Iphone XR 64 gb  if you allrdy using iphone than u will love it and u buying is first time than u wll flll in love for sure ..!!! I am giving this review after using my iphone XR for more than month..!! So trust me guys its good and original product.!!!,5.0 out of 5 stars,Original product with good delivery
428,I just loved it! Brother just bought iPhone 11 and I thinks the XR battery life is better than 11 and 11 has heating problem. I loved the phone its fast fast and very fast with fabulous camera,5.0 out of 5 stars,Totally Worth it.
429,"Not happy with the mobile , let me know if u guys can send new mobile or can give a option to upgrade to iphone 11 . Let me know what best can be done .",1.0 out of 5 stars,Not happy with the mobile
430,The first thing you notice about XR is it’s battery. Super long battery of more than 24 hours. Rest is exactly as it should be in an iPhone. Camera also needs a special mention. Great camera.,5.0 out of 5 stars,Great Battery and Camera
431,"Does what it is supposed to do. True iPhone, no exceptions.",5.0 out of 5 stars,Probably a better iPhone.
432,Gud phone ...camera is super..,5.0 out of 5 stars,Trust it it's total secure package
433,iPhone XR does not have finger print reader as it’s unlocked with face reading..,5.0 out of 5 stars,Great mobile
434,"My infact upgraded from my iPhone 7 to XR. It’s been more than a month I am using it and has no issues. Amazon had the best rate and it is during the Flash sale , I picked it up at 49,999/-.  Their delivery was prompt and was prior to the committed date. My IPhone XR has a fantastic camera, a fast processor, exceptional battery life and high quality display.",5.0 out of 5 stars,Excellent iphone and great service by Amazon
435,There is nothing much to say specially about iPhone. I have used several android devices and I switched to iPhone XR from OnePlus 6. Simply this switching is fabulous experience to me.,5.0 out of 5 stars,Loved it
436,"Got it for 39000 in the great Indian sale along with exchange (redmi 4) and using SBI credit card. Anawesome phone. Once we use iPhone, android phones seem cheap. You start appreciating little details that Apple has done to make this phone worth its price and hype. If you can afford, then close your eyes and bye it. You will not be disappointed",5.0 out of 5 stars,Worth the money!!
437,The box was not sealed and looked re-packed.,1.0 out of 5 stars,Defective packaging
438,I have used iPhone since so many years,5.0 out of 5 stars,Battery and Performance king
439,Got this phone at a discount price in amazon. Slightly heavy but good looking phone with terrific battery life. The phone is fast with a very responsive face detection.,4.0 out of 5 stars,Splendid performer
440,Genuine product received from seller Darshita Electronics.Everything is fine after 7days of use.One thing is the set getting heat whenever large file is being downloaded or playing game.Rest everything is just cool.I’m loving it.,5.0 out of 5 stars,iPhone XR white review
441,"Awesome phone, great battery life it can last upto 2 whole days, face ID works great even if you are in dark room. Screen size perfect so that we can do tasks using single hand. Will get long term support. 5w charging adapter works well but it's good to have 12w charger than 5w.",5.0 out of 5 stars,Awesome phone
442,"Feel big for iPhone 7,8,6 users.",5.0 out of 5 stars,Best Value IPhone
443,"I love iPhone XR very much. It is user friendly, top notch though there are compromises compared to the other models especially the flagship ones. Overall, it is a highly recommended phone for all the Apple fans and iPhone lovers. Thank you Apple!!",5.0 out of 5 stars,Coolest Phone!!
444,"Make sure you read all instructions, check package and then give OTP. the phone was brand new and is working great. had reservations about online delivery but this experience was seamless. Good to get this discount at discount. Excellent product.........iphone XR is jet fast. loving it.",5.0 out of 5 stars,"Delivered Safely, working great"
445,"Awesom, getting 1day full and few hrs more. 3hrs of Pubg, 2hrs of skype meeting, calls msgs, songs, internet. Finally iPhone had worked on battery. This is all from normal mode.  Pow power  mode is even better.",5.0 out of 5 stars,"Great on battery, performance"
446,Dont go by the reviews that mention fake product !! Its very much iphone xr that i ordered !! How the phone is would b a very personal view point but it’s definitely not a fake !! Thank god i went by my instincts and got a great deal,4.0 out of 5 stars,Got what I ordered
447,Super smooth and premium product nice camera good battery life quick face unlock even in dark. Plays heavy games with high graphic settings without any lag. Overall a very good product,5.0 out of 5 stars,"Premium product, worth every penny"
448,"There is a problem of signal. It is frequently going, where as other make mobiles are having good signal. Now the voice of video has also become very low. Not a good buy.  Can any guide where to report the issue.",1.0 out of 5 stars,Having problem of poor signal.
449,"I like everything about this product. I ordered this iphone xr on end of festive sale and Amazon delivered the product in the given time period. Everything in this phone works good and fine , no doubts. Amazon gives 100% product to us, they never unsatisfied me. At the end Product's performance outstanding . Amazon delivery also secure😊.",5.0 out of 5 stars,Online shopping is safe and secure😊. This is genuine
450,Really really good product..if you have budget of 50-60k you should definitely go for iphone XR..excellent batterylist last of 1 and half day..brilliant camera and superb portrait mode !! Ive purchased in 52k in amazon sale..it is surely value for money !!,4.0 out of 5 stars,excellent camera !! Superb battery life !!
451,I like this phone.,5.0 out of 5 stars,Awesome phone.
452,"I got iphoneXR at very reasonable price. The apple company has made one thing better in this model i.e. battery life. The phone runs for 2days with full charge. there is no finger print reader in this model although face id is very accurate, it scans your face even in the dark. There is no doubt about the picture quality when it comes to iphone.",5.0 out of 5 stars,A great product for iPhone fans
453,I am big Apple fan from almost decade 😃and they have never disappointed either on the hardware side or the iOS( operating system). Got this from amazon deal at very attractive price,5.0 out of 5 stars,Value for money
454,It is really a good one by apple. Easy to use and very fast processor. I just love it... and big advantage is it supports dual sim but now the price has been dropped to 54990 by apple in india,4.0 out of 5 stars,WoW
455,Ya really super phone/they’re confusing to(AirPods &Earpods) this phone with EarPods with lightening connector only not for Bluetooth AirPod ur clearly understand then u will pay,5.0 out of 5 stars,Good
456,"I switched from Android to iOS through this and so far it's been amazing, the battery goes 1.5 day with heavy use, camera's awesome and the new iOS 13 gives all the features that you need.",5.0 out of 5 stars,Great one
457,"They gave me a faulty phone which i came to knew after one month,",1.0 out of 5 stars,Freezing and Heating problem
458,The product is excellent.,5.0 out of 5 stars,Excellent mobile from apple
459,Nice phone. Worth buying for the price. Only regret is the price went down by 3000 rupees within one day.,5.0 out of 5 stars,Nice product by Apple
460,I have not yet opened as the outer cover seems damaged,3.0 out of 5 stars,Cover damaged
461,After using it for 6 days properly . The phone started to hang it automatically restarts and gets stuck on apple log had to format my phone 2 time. Apple service center could not detect the problem . THEY Said it should be sent to bangalore for repair due to some motherboard issue . So i dnt want all that headache i want my phone replaced by a new sealed pack same iphone,1.0 out of 5 stars,Defective product
462,No lesser than iPhone XS Max,5.0 out of 5 stars,Worth it!
463,"At Rs 35,000 (big billion sale + exchange offer), its a steal. For phone review, go to google - there are plenty of XR reviews. As good as it gets",5.0 out of 5 stars,Best in class iPhone
464,"What a phone . Display is not a concern ,it's brilliant even it's 720p.build is excellent .",5.0 out of 5 stars,Excellent product
465,"It's a very pretty and good looking mobile. Performance wise, it is super smooth. Camera is as good as iPhone XS, portrait mode is also good enough.  And the best part is, being an iphone it has a long lasting battery. Though it has LCD, but you would hardly be able to find any difference between this and OLED. Size is perfect, infact everything is perfect and cool!",5.0 out of 5 stars,Go For It!
466,The phone is definitely not performing per iPhone standards - frequent Call drops ( the issue is not with network provider ) and battery life is worse than iPhone 8.,2.0 out of 5 stars,Not upto the Mark IPhone XR
467,"Back glass of Iphone got broken after one month of buying without any prior incident. Disappointed with the service provided by Amazon. If something happens to our product, Amazon will be saying to contact Manufacturer.",1.0 out of 5 stars,Product was damaged.
468,"Face ID is very very slow. There seems to be a problem with the microphone. There is an issue with the sensors. Microphone issues, touch issues. I’ve been trying to raise a complaint but the amazon support team is always redirecting me to the apple website. I’ve been unable to return this item since I’ve discovered the problems. I really need assistance on this matter.",1.0 out of 5 stars,Refurbished or defected
469,Great phone = great battery life + great camera especially in low light + great security and face recognition. Very happy and bought it at the right time before the prices went up again.,5.0 out of 5 stars,Great phone !
470,Like the luk and fallen in love on firstsight. Feel great when unlookers give an appreciative glance. Invaluable asset.,5.0 out of 5 stars,iPhone is the best
471,"In portrait Camera - while taking a photo of a substance or anything (other than people)it always says ‘person not detected’. portrait function is only for people , not for the object.",5.0 out of 5 stars,"Quality and all are good. But, portrait function is only for people , not for the object."
472,"What to say it’s Apple amazing man but when you’re buying this mobile better you should buy a CaseAlong with it because the backside of mobile is slippery and made of plastic plus glass,,Worth to buy it",5.0 out of 5 stars,What the
473,This is the best product from apple till date.,5.0 out of 5 stars,Best iPhone ever created XR
474,I just love it.it has got all I want.good camera decent battery life good sound etc etc.and the display do not give me any problems.if there is something to complain about it is the price.,4.0 out of 5 stars,Good job by apple
475,"Superb smartphone. Certain features of Apple makes it completely class apart. Great battery backup, extraordinary camera quality, support of dual sim etc segregate it from the other brands.",5.0 out of 5 stars,Best iPhone ever.
476,Best value for money in iphone . I am extremely satisfied with the purchase with no worry for storage for this 256 GB model. Wireless charging is just wow.,5.0 out of 5 stars,Best iphone with value for money
477,"Its a perfect phone, though a bit heavy coz of the metal body. I got this in red colour which is my favourite and its such a settled red, basically its a mixture of red and maroon. Camera quality is also good not the best as compare to other apple phones. Overall i love my phone as its a gift from my darling husband.",5.0 out of 5 stars,A good buy.
478,Timely delivered. Gr8 deal from amazon. Few months back I ordered one plus mobile from same seller. They delivered original product.,5.0 out of 5 stars,Excellent deal n phone..
479,Simply love XR! Battery life is great and I’m not really missing the telephoto lens! Do buy product red as it support AIDS Research.,4.0 out of 5 stars,Great phone
480,The product is working fine. Just as expected from apple product. However there were two scratch marks on the sides of the phone just after unboxing which is very strange,4.0 out of 5 stars,Good phone  but scratches on side after unboxing
481,It’s always a charm to use iPhone. Ease of use and fast response are key.,5.0 out of 5 stars,iPhone with best battery till date
482,This phone is hanging n seller is not returning or changing this phone I tried many times but,1.0 out of 5 stars,Worst seller of this amazon
483,"I have been an apple patron for a while.. I Started using the Iphone 3, 5, 6, 7 and now i bought the XR.. I honestly feel that its terrible.. Just a hype build around it.. The Face ID never works, the camera gets stuck on its portrait mode.. My honest feedback is not to but the iPhones anymore. Just will have to say that Apple lost itself a good customer..",1.0 out of 5 stars,Not Worth It Anymore
484,"Excellent phone I am happy I suggest u all to buy with amazon, because maintaining genuine sellers with good quality products and the biggest most important  thing is  customers support I am very much happy with amazon and their customers support. Hats off",5.0 out of 5 stars,Thank full to amazon
485,I bought a new iPhone XR from amazon and the delivery was within 24 hours. It was a brand new pack sealed.,5.0 out of 5 stars,iPhone XR is amazing
486,"While I started using this phone, I realized that my takes much longer time to get charged. However, other phones I have get charged quickly from their respective cables. I am unsure about the originality of the product received.",2.0 out of 5 stars,Fake Charging Cable
487,Not a value for money product.Apple is still giving 1amp charger with such expensive phone with almost 3000 mAh battery. The same charger is also  given along with 5s and also SE.,2.0 out of 5 stars,Not worth for such price tag
488,"Bought this cell phone for my retired father. He is a person who wanted a great battery life, good camera and great speakers with ease of use that is not present in any android cell phone in the market.",5.0 out of 5 stars,Great iPhone at great price.
489,I have got the product in one piece that’s true but this product is defected one. Out of two speakers one is damaged. I am regulars IPhone user since from past 5 years and that’s why I could point it out. Amazon - kindly notice,1.0 out of 5 stars,Defected product
490,The battery is not a 4000 mah  like many other phones these but still has a lot of life in it . This is my second IPHONE and the performance just outclasses any android phone,5.0 out of 5 stars,Performance
491,Excellent-The best we can purchase with small amounts purchased for 42999/- at offer from amazon,5.0 out of 5 stars,Small handy phone excellent no issues
492,Osome product but I suggest get iPhone 11 updated version of iPhone XR.,5.0 out of 5 stars,Product review
493,Beautiful phone. Great camera. I just feel that the phone gets heated a bit I guess I am not sure though as it’s my first day on this phone and have been constantly playing online games,4.0 out of 5 stars,Great buy
494,Value of money is excellent but little costly,5.0 out of 5 stars,Value of money is excellent but little costly
495,evrything is good.problem compared with mi poco f1 Rs15000.waste of money..,1.0 out of 5 stars,ahhh money lost
496,"I love apple products, have been using them since 2009 and this is the finest iPhone I’ve ever used.",5.0 out of 5 stars,Very good
497,"I received my order yesterday and the voice recorder is defective, have spoken to apple support, after troubleshooting they recommended I get it checked at an authorised service centre as it seems to be a defected piece.",1.0 out of 5 stars,Defective
498,"I bought this phone on Big billion day. It was well packed and the phone is very good. Battery quality and camera quality is  amazing. Those who do not buy yet and thinking for it, go for it, it will not disappoint you.",5.0 out of 5 stars,Value for money
499,"Size is bit over, good battery life than previous products. If you were using iPhone 6,6s or 7 might find it bigger to hold because it’s size is 6.1 which quite big for iPhone if you never used plus editions.",3.0 out of 5 stars,Value for money.
500,Faulty charging cable it charges phone only from one side. When buying online check every aspect before actually using it,3.0 out of 5 stars,Faulty charging cable
501,The phone I received was defective. Please think twice about buying apple products as I faced the same issue with my MacBook Air. There is no solution provided by Amazon which was surprising as they use to have very good customer care. I feel I have wasted my money.,1.0 out of 5 stars,Defective product
502,The processor is not that speed as expected.,1.0 out of 5 stars,Slow
503,Just received the phone and checked for the warranty on apple site. It’s showing that purchase is not validated...after 4 hours again I checked. And smile on my face. Apple said your purchase is validated and warranty,5.0 out of 5 stars,Warranty not found.....and found after 4 hours
504,"Amazon is sending defective devices, please don’t purchase.",1.0 out of 5 stars,Used/defective device
505,Best phone for those users who really need a very good battery life. Camera supreb and video stabilization is just fabulous. Go for it 👌👍  A bit bulky feels like u r carrying a mini RDX 😂😂,5.0 out of 5 stars,Excellent and honest review.
506,I personally like Apple product. But my charger is not as good as it shout be like an apple product. After a moth of using my charger stopped working.,5.0 out of 5 stars,Awesome 😍
507,Overall the phone rates 4/5 considering the price of 49k for a128 GB. Camera quality is gud but just has the basic features and no advanced techs like the ones in oppo /Mi .Battery is gud .It will sustain a day for me (I don’t play games).Call function is what worries me in this phone.It gets stuck all of a sudden while attempting a call.,4.0 out of 5 stars,Gud buy at this price.
508,"First off all I would like say, the delivery boy of amazon is very polite with consumers.",5.0 out of 5 stars,After 1 month used
509,Faceid not functioning after 15 days.phone freezes once selfie portrait mode is activated.Face it does not work anymore now,1.0 out of 5 stars,Faulty piece
510,Android no match to iOS.,5.0 out of 5 stars,Best iPhone model
511,"A gift for spouse, a bit on bulky side but an effective gadget",5.0 out of 5 stars,So far so good
512,I've been using this phone for almost a month a now and this is the fastest smartphone I've ever used. I know this years iPhone 11 is faster than this but after watching a tons of comparison videos on YouTube I've decided to go with the XR. I don't think it's worth the extra bucks and I'm very satisfied with this purchase.,5.0 out of 5 stars,iPhone XR - Best iPhone ever
513,Amazing smartphone with best build auality and camera have amazing pictures and battery life is also good but only one problem back single camera after all money value product,5.0 out of 5 stars,Money value product
514,Before buying this product i was so scared that what if the product is fake or may be used.,5.0 out of 5 stars,Iphone review
515,We bought the phone during sale period near Diwali. Its nice phone with big screen. Ideal for people who reply to emails or do a lot of work related chat on the phone. Batter life seems to be really impressive. It goes without charging for 1.5 days with constant internet connection.,5.0 out of 5 stars,Battery life is impressive
516,"The phone had a software problem, the microphone wasnt working.",1.0 out of 5 stars,Defected Product
517,WoW experience,5.0 out of 5 stars,WoW experience
518,"This is clear update for me after iPhone 7. Camera quality is awesome. But the most impressive thing is battery life , it was seamless. You could miss 3D Touch but it’s ok .",5.0 out of 5 stars,Awesome iPhone for me
519,"dont buy it as doesnt come with dual sim slot , for this esim required and in INDIA only jio and airtel provide e sim technology",1.0 out of 5 stars,dont buy
520,Value for money as good quality and money wise but price daily coming down in the market as Amazon price and market price is down,4.0 out of 5 stars,Good as expected I phone lover since day one
521,"dont have to say much,  apple is apple and makes best phones,  once you buy apple you dont want to try any other phone,  it is amazing phone",5.0 out of 5 stars,Apple is apple
522,Heating so fast in use after 15 minute of use,2.0 out of 5 stars,Heating up
523,Very very bad product accessories very cheap quality packing .....Also facing problem regarding warranty ........Just after 6 days of purchase ...Charger adapter and lighting cable ha failed ...And ...Apple care is also behaving badly ... Highly disappointed regarding .....Please give me a way to return my phone.....,1.0 out of 5 stars,"Cheap accessories , highly disappointed"
524,"Really user friendly, user interface is buttery smooth..camera quality awesome( esp. portrait mode).. not sure how it compares to iPhone 11, I’m happy with this phone",5.0 out of 5 stars,Excellent phone (as expected)
525,"got a discount on hdfc card. bought it to gift some one else. As per the users response, its a good phone, works effectively",4.0 out of 5 stars,good item
526,"Doesnot look like an original iPhone, keeps hanging its not even a week old. Doesnt take finger commands well n hangs continuously. Pathetic product. I need a replacement",1.0 out of 5 stars,Duplicate product
527,I am loving it...!!!! Upgraded from android,5.0 out of 5 stars,I am Loving it...!!!!
528,Fingerprint reader is not there only face lock which is more than perfect,5.0 out of 5 stars,Awesome phone better than cheap Chinese phones
529,"Amazing battery life. Even on heavy use, the battery lasts the whole day easily. Iphone XR is super smooth, face unlock is fast and really impressed with the privacy option related to apps. Best iPhone to use for its 55K price",5.0 out of 5 stars,Iphone XR - A complete phone
530,"This is my first iPhone XR.... After using the phone I realise why the iPhone is special....the features, screen touch, the look, are all awesome.... Happy To Be Purchase iPhone....",5.0 out of 5 stars,iPhone XR
531,I purchased iphone for brand n its dual sim and i found it more value for money.,5.0 out of 5 stars,Value for money n Brand
532,"The phone gets hanged during every incoming call .i practically have to cut it and call them back . NOT very please with Apple ,expected a better working phone for the price they charge.",3.0 out of 5 stars,Review after 3 months of purchase date
533,Bought it during the second great indian sale for 41k. Though 3k higher than the 1st sale I am very happy to buy it as I know it’s a good deal. I am very much statisfied with the phone quality and delivery speed. But the packing quality should improve.,5.0 out of 5 stars,Great Buy
534,"In fact, the features and functions of this mobile are very good, especially the price is very low, which is 39 thousand only, and the mobile was delivered in a very short time, it is now priced at 45 thousand,",5.0 out of 5 stars,Awesome Products Purchase Only On 39900
